<?xml version="1.0" encoding="UTF-8"?>
<xs:schema xmlns:xs="http://www.w3.org/2001/XMLSchema">

  <!-- Define the element bookstore -->
  <xs:element name="bookstore">
    <xs:complexType>
      <xs:sequence>
        <!-- Define the element book -->
        <xs:element name="book" maxOccurs="unbounded">
          <xs:complexType>
            <xs:sequence>
              <!-- Define the elements of the book -->
              <xs:element name="title" type="xs:string"/>
              <xs:element name="author" type="xs:string"/>
              <xs:element name="year" type="xs:integer"/>
              <xs:element name="price" type="xs:decimal"/>
            </xs:sequence>
            <!-- Define the attribute ISBN -->
            <xs:attribute name="ISBN" type="xs:string"/>
          </xs:complexType>
        </xs:element>
      </xs:sequence>
    </xs:complexType>
  </xs:element>

</xs:schema>
